Tweet,Username,AverageAnnotation
....stones taught me to fly <love> love taught me to lieee....,royaljesy,0.0
 that's a demon not fucking kittens i'm telling u,sydneydavisss,-1.4
no one cares. you're a whore.,Tori_Mace,-1.6
i'm not good at many things but fucking shit up yeah i'm a pro at that shit,Wright98Isaiah,-1.75
enhancements to student financial assistance program helps learners go further faster - sk gov press release,SaskPolytech,0.8
pag naging maid of honor ako agad daw ang susunod na ikakasal! .. pahingi muna ng jowa! <laugh>,angeLmichSG,0.2
we all want what we ain't got love this song and its so true,Shania_Hansen,0.6
bmj: we are amerithaikong,sugasweg,0.4
mama kata krja dpt duit banyak nnti design pelamin sndiri. buat lah mcmana nk hahahah,theninis_,0.25
i really need a lap top ... like now . i would feel so much better knowing i have everything on my own computer,reynsss_,0.8
 but they were so in love?,Please_No_Pics,1.0
 make fun of the stupid shit someone says. by all means. but it's basically namecalling.,gmcalpin,-1.2
 hahahaha outta topic apenye.. abg ipar awak pun x lama lagi kenal laaa... soon <happy>,aliyyah92,0.8
 pristine presentation umm shots fired,EdwardDaniell_,-0.75
great news. i am a #1 seed in the march sadness brackets. i feel i can take it all the way this year.,chrisspangle,0.4
the numbers are alarming. but seriously. no one from plucky lichtenstein?,LukeReuters,-0.2
 geez people. if this were us and uk flags would you also question loyalty and claim treason?,adrianraiford,-0.3333333333333333
from ontario court of appeal says endangered turtles trump wind farms,financialpost,-0.2
how u gonna kill a character that lives in the book. homie?,righteoustiger,-1.25
it's cooool lol,The_SexiestGoon,1.2
lord knows it was a slow day for tips,SaveThe_Tits,0.25
if aj was in the title match. everyone would be bitching about it. take what you get people. the card is already stacked enough.,SupportingBryan,-0.6
 ty for share. the corruption. like most for pols butts right up against moral line. i just don't think it will damage her.,progressive4u2,0.5
 ok thank you so much! and are you able to check if they have the black one in a petite size 4? <kiss>,shiminlim,1.2
when life puts you in tough situations. don't say why me say try me,hherreran1,2.2
 i am laughing each time i read it loool,rf_fangirl,2.0
kalamazoo telegraph newspaper 3/8/1905,BeckyRParks,0.0
i called jack in his geography test and his phone was on loud and he told his class it was his annoying b*ch of a girlfriend i'm v proud,xntisxcial,-1.0
 found nothing ? really ? damn. googles slacking .,_iamPRYCELESS,-0.75
i don't know how many are on but the art show was really good! props to ,They_call_me_po,0.8
payday for most! go out and buy ur loved one something special. even if it's your kid. spoil urself too of course! smile you have a nice one,PhillipJCarter,2.25
sobriety is not fun.,trippedvibes_,-0.2
ahh this prick that is working in the hospital reception needs to get her face run over by a lorry,yohhnaaa,-2.0
jim m. didn't want charlie killed.,AllThingsMSR,-1.2
guys! i am selling my 2-week old lg optimus l300 series phone. plz. pm me if interested. specs:,iammaxcorpuz,0.8
 when the whole arum story sounds rotten. the wrong year matters,Fletch_Butcher,-1.5
 :sad news,HOLAcademy,-0.8
im literally about to cry,wild_is_my_life,-1.4
for a society who has a goal of equality. there sure are a lot of classifications. categories and considerations dividing everyone.,Simplekindoffan,-1.4
 skills <laugh> <laugh>,Stephxtravers,0.4
 hehe. read those in reverse order!,MikeAlexander86,0.6
i fall in love w anyone who asks me how my day was,bbyputah,1.0
 are you serious....,reynsss_,-0.6
 i'm gonna try to come soon. i miss y'all so much.,WenrickMadi,1.5
 vip vacations is so proud of our for being 1 of your top 50 agents! #vipstrong,travelgaljd,0.75
man i'm so slow sometimes i be pissing myself off,Shanza_k,-1.6
farage may be about to quit. but in his recent history he's successfully changed british politics. a sad. sad reflection of the day #ge2015,ClaretRaz,-0.6
 awesome. i may be one of the few people who wanted this. lol,AllThingsMSR,1.0
 person appreciates that uniqueness and can value us &amp; themselves at the same time w/out having 2 devalue either.,WillJaxx,1.0
i love softball so dang much,zoelyoung5,1.5
 i was gonna @ you in it earlier but even i knew it was too fucked up,Rike12Modriguez,-1.2
#rangers make habit of winning these close games.,JAsports70,0.5
so. who won lagos ?,sholaWA,0.2
boring af like bitch if you,Tori_Mace,-1.6
spoken to 1.000 voters in the last 4 months-i loved every moment of it! i wouldn't change it for anything else.love it! ,ElzbietaVine,2.2
 happy belated tho mayne,babylexx_3,1.0
i don't normally deserve nice things but i'd like to think i've deserved my day off today. 1st since forever when i have no plans at all.,FooledBySecrecy,0.8
i miss my family <sad>,BridgetAKennedy,-1.2
and why why why would you end your breakup speech with the equivalent of saying oh yeah im gonna go to his house and fuck him tomorrow,yessequitur,-1.3333333333333333
 - another kiss against him.,Bonnibel_Peebs,0.5
 i still love hb,peabunnytree,1.4
with the support of my early morning gym family i was able to get my bench over 100 today!! finally starting to feel strong again!,BridgetAKennedy,2.75
happy day 16 of #christmaskindness x surprise a loved one today with a random act of love xxx #surprise #giftoflove,Happy_Boho,2.0
 so am i i been labour all my life but whats happened we been soundly beaten we need to sort ourselves out im a socialist are we?,itiddly,0.0
 when you can program your brain to ignore fear,travelgaljd,0.5
#sagittarius : do not betray. you are able to calm down and stop doing crazy about the person you care but you will decide.,ViralHoroscope,0.8
give pll a little more credit,thehybridthings,1.0
my first proper. up-close view of london's #shard. looks great,LukeReuters,1.0
sums up pretty much all of our conversations. ,queenbdot_,0.0
spurs/clippers will be a great game tomorrow night. #gospursgo,CLF_423,1.75
don't feed your child fast-food. it will ruin your child's body. mind. and it will brand their political spirit.,_DearParents_,-0.5
 dude some people are like choosing their fav/4 from aspectrum,shiminlim,0.6
 it explains a lot! that's why he has been so encouraging with me. he knows how difficult it is to change.,rainadobson,1.25
join the very first #kahchat today at 4pmest sponsored by #kidsareheroes.,dawnranieri,1.0
#mondaymotivation: let your heart be kind. your mind open and your will strong.,4charitysystems,2.25
we were mother-daughter book club snack heroes with our deliciously awesome cupcakes! #ldnont,corazenia,1.6
 # sending love#light have an adventurous wed#,andrealegend,0.8
 others??? so that's how it is yeah!! cool!! safe!! see you never!!!,yOgI_jYoTsNa,0.0
i haven't played candy crush all day that's when you know you're sick,BUCK_MONEYY,-0.8
 *hugs chu* i was so fucking scared i nearly passed out,Clem_Walker,-1.4
 considering how much i had to spend on my flights i would have been better getting a train,Refshaleoen,-0.25
thank god for my brother cause i know he would do anything for me and i'd do the same for him,Wenger_7,1.75
go and put your feet up #nickclegg. you did a bloody good job in v diff circs but there's a new guard now #libdem #ge2015 #nicechap,The_Bounder,0.75
does the brain have a sweet tooth for candy crush?,Adlewis91,0.0
sharing a little jane austen wit and wisdom on a lovely tuesday afternoon!,susanwiggs,0.5
so i'm as good as on my own in the house tonight. i might watch the babadook. what can possibly go wrong?,mburnhope,1.4
all they got all fancy just to lose #fuckunc #dukevsunc,prettylaurynn,-1.2
whenever i'm sad i just try on my prom shoes and i feel pretty and happy,skyesailing,1.0
i'm sorry for loving you,shanamaina,-0.4
 sorry such a late response-phone was acting up. i'm in boston now for a work conference. would much rather be in vegas still!,DeanneCP,-0.4
why is everyone laughing i'm confused,ShainaDawnn,-1.0
80s movies are cool af what ever happened to our generation,playboyespinosa,0.0
sin. the lustful stage play at madison street theatre | metromix chicago,4keithm,-0.5
i hope your day was good.,smilingforjack,2.0
you know i want to die but im really afraid of death i have no purpose to live all i am is a worthless pos and a waste of time just kill me,ShadowNinja1611,-2.0
 idk but i look good,ShainaDawnn,0.8
neville would be a shar pei because fat and kinda ugly as puppy but majestic when mature,righteoustiger,-0.4
in love w ur icon !!,zouisfitch,1.0
i wanted to say something. a joke. a sappy metaphor. some semblance of communication. but instead i sat. stung by silence &amp; unable to speak.,Satori_Paris,-0.4
honest to god i just want one od to be successful,TaylorLBSanders,0.8
#nascar tweetcast for - fri &amp; sat sunny. cool 62-67 for sun partly sunny high nr 70,NASCAR_WXMAN,0.0
i... i should of paid attention.. &gt; she began to sob more.. she's in great pain because of this mistake &lt; i bet he's moving on already..,aromaticBayonet,-1.5
 looks like it'll be the u of virginia!,Arlene_HR,1.6
 if you're lucky. eh -- wink wink nudge nudge,gmcalpin,0.6
i am a weak and temporary creature. made out of mud and dreams.,A90s_,-1.2
lol at katie convincing me to get ice cream,surmerntha,0.6
most happiest place on earth <happy> #myhomeawayfromhome #obx,cassandrahanif3,2.5
 i really hope i get this. im praying lool,_asxp83,1.4
if only ppl read the convos w me and cass hahah #lezbos,victoria_alvaa,0.5
my main problem with the green party is the fact that if you drive a car they fucking hate you,LiamShikari,-1.0
feel like i've become a retweet but all in a good cause,e4c5,1.0
 just wondering xd but do you believe in conspiracies just to argue and make people think?,xchrisxchaosx,0.2
just sittin over here like is it friday yet?'',CatieKing21,-0.6
wow in meetings for a few hours and just now seeing skins news #httr #redskinstalk,ChadWst,0.2
. &amp; doing the colorado v arizona game. it's like a broadcasting dream team ! awesome,jvanryn2424,1.2
just be real y'all. i can't stress that enough.,_KayleeTho,-1.6
 lool i can't tweet rubbish about my team. we have lost yess. soo let me support my best player and the worlds best. #cr7,AlbashG77,0.8
it feels like i'm sorta drowning. like there's fluid in my lungs and every time i cough i just wake up gracelynn ugh,CarverKrista,-1.2
i am going to have a long. long nap and it's going to be just amazing,tatsieff,2.25
mom and dad (beth and carl) are both gone this weekend! i feel like aaron carter right now #aaronsparty #cierasparty,cieramackel,1.6
 hi connie. you said not over twitter. i was wondering why you don't want to discuss africans fixing africa. seems fine to me?,supergoodlus,0.0
j love for me is renewed rekindald stronger deeper higher ever before growing so very strong j ...,request_prayers,1.6666666666666667
black friday prices are out!! go to this link to see all the great deals running through till monday evening....,SweatCardio,1.0
 no i don't think so. just a supporter,Effiedeans,-0.4
yo all you pioneer mfs better be at this cheer comp. some of these other student sections are pretty big.,toraye_,0.0
oh well not like any of you care,royaljesy,-1.6
there are no quick fixes for the problems in baltimore. but its people give me hope | farai chideya,wimpysoftheart,0.6
 good luck. sad to hear you are not at your best. obviously have good people looking after you making sure you get best treatment.,BoagMaureen,1.2
oh ok phew i was gonna go all cubes jealous there,rouukun,-0.8
everyday i'm working on becoming a better me...#everyday,Syrania,1.4
a long habit of not thinking a thing wrong gives it a superficial appearance of being right.,4charityvision,0.8
dont even get me started on louis. he's achieved so much at a young age and he does so many things to help everyone and be nice.,TOUCHDOWNIALL,1.0
 i hope so. you know where i am if you need me. <kiss>,X_Not_Perfect_X,0.5
 have you gotten to the hours and hours of paint smell yet? because that's also really fun.,BeckyRParks,1.5
 thanks that's why i found out his name,shanamaina,0.6
 alisha ....wayne aint smash drake on truffle butter ? lol,grind2times,-0.2
but i can't get you off my brain #fifthharmony #theyretheone ,reblogally,0.6
 or. in other words... would your preference be for the city to consult on environmental issues with a pro oil sands org? #ha,tukatweet,0.8
#patriots to the day i die . win or lose . i been a fan for 13 years .,prettylaurynn,1.25
 the short one? or the weird creepy one?,TehhKota,-0.8
 how do you plan to safely dispose of your compact florescent bulbs? what is the safest way? (we have lots too).,BillBelsey,0.8
 they'll still be bad. xd yeah. wizarding world is amazing. as is transformers. despicable me. springfield.,YellowCranePr,0.8
 i think moments take better pictures. capture better vignettes.,Satori_Paris,1.6
 you're just mad because you're wrong,saltandburnitt,-0.8
course if that's not it. there's going to be a few embarrassed cow-horse adulterers this morning. 'i knew it! he doesn't even look like me!',georgekemp,-0.2
 from that we got year one and tdkr. both of which are daredevil stories through and through,Kal_L_Superman,0.0
my bun is a good 4 inches taller than my head right now.,Tinijensen,0.2
: 21 &amp; 25+ cus i heard men's brains aren't fully developed till that age lol,grind2times,-0.25
you're a little fucking slut.,Tori_Mace,-1.6
putin threatens with war against europe,ElzbietaVine,-0.5
all this loving goes in vain,angelnieto101,-1.6
and perfect af . . . ily,zouisfitch,1.2
 cramming 5 days of work into 4 will do that <tease>. it was certainly a busy one! if you have a second wind. come join!,alixcote,0.5
never underestimate the power of a kind word or deed.,hherreran1,1.75
2015 can be a wonderfully fantastic year for you. but you may have to do what you've never done and go where you've never gone to get there,WINIMINISTRIES,1.8
 yes name too long sorry ha,brydesantis,-1.0
it's mad how instagram doesn't take down these kind of images,TEAMKRUZE,-1.0
 lmao god dayum finally! btw gma is making ceviche friday so look forward to it and shoot thru 1x,verenis_,1.25
#bestfandomca2015 because we are still in love with them,xlarry_rainbowx,1.4
words cannot express my excitement #abvote,Brit_Mathews,2.4
what comes easy won't last and what lasts won't come easy,Ch3ryB3ary,-0.6
anyone ever just write down what they want to say. read it 3-5 times. then throw it away and feel better?,Tbass_71,1.6
 its because you picked a powerpuff girl (ok its not but i'm happy for you <love>),runyonhanlon,1.4
so funny when people push me out of their lives. your lossssss!,VarnerKaleigh,-0.5
 it was the sweetest thing. and they both had those big smiles &amp; my heart was happy,afooltocry,2.0
how to survive a horror movie 2 | mattg feat jay,yourghostlyfox,0.2
all is violent. all is bright,Cobblywobbly,-1.5
at least 10 degrees warmer than denver here in the upper elevations this morning. expecting snow today; up to 3 ~another 2 poss tonight.,tomfricke,0.75
fucking hate having sleep paralysis,ChrisRafc1995,-1.0
i get so confused when people complain about sports that get over at like 8.... half the time cheerleaders don't even finish until 10 lmao,sydneydavisss,-0.2
nb is trynna fight where is king louis,TOUCHDOWNIALL,-0.75
i wish i didn't watch that video. it traumatized me.,Clem_Walker,-1.0
waiting on bray to save his brother like...,SupportingBryan,0.0
i'm such a boring child,twurkdallas_,-0.8
 im just saying you wouldnt expect that from them so im a lil pissed off... anyways next,realistiches,-1.2
what would life be without #mexicanfood? #fatescruelerthandeath,JoseOleCentral,-0.8
 // there's a cutoff where it's no longer loli and its just..uh...pedo crap. right?,Bonnibel_Peebs,1.0
just seen a picture of noni and i literally want to cry ...,dandreal_,-1.6
home made simple's patrick brown shares what makes a happy home,ArlenePellicane,1.5
 very of luck for your 100 miler today. go forth &amp; smash it.,theMonkeySmokes,2.0
from making games at tojam may be for fun. but it can also be profitable,financialpost,1.0
hop over to my blog and enter to win the book never be the same new year still...new you!,ArlenePellicane,1.5
this protest the hero station on pandora is perfect for feeling pumped while washing dishes,Cobblywobbly,0.25
 lol n few others..,Sharanyashettyy,0.0
as if i wasnt having a bad enough day. i burnt my mouth on some chicken and now i have one of /those/ things on my tongue <sad>,chelsreynolds1,-1.8
 just told me that oreida is a portmanteau for oregon and idaho. mind blown.,BeckyRParks,0.8
 hi. matt at the ipswich star. working on the steamboat gig cancellation story - do you have two mins for quick chat? thanks. matt,mattjstott,1.0
 wow i guess the nc state educations really is paying off so far,CGommo,0.8
bakit may echo talaga yung kanta hahahaha,maaaaamro,0.6
 happy new kids on the block day! can you please play summertime?,DeanneCP,1.4
 suck my dick,ZeeAsianBarbie,-1.0
tired of people telling me i have good luck. there's a difference between being lucky and being blessed. get what you pray for.,Awes_ma,1.8
nice quarter kobe #lakers,ChadWst,1.2
 of course talk again whenever! until then. lol! <happy>,YoItsLilBlue,1.0
today stats: one new follower via,eksotinkerbell,0.8
delete your social media for 3 weeks. see how many of your friends hit you up. you'll be surprised,_cha0sxo,1.0
 still got none lol,abbiexmcmaster,-0.4
 hahahaha 5 bucks!? nigga i'm worth at least $50 and that's in a recession!,Please_No_Pics,1.0
vous faites chier ma tl avec cette histoire de followers gratuit ptn!!!,Alicia_Dkg,0.0
just because you forgive someone doesn't always mean you're inviting them back into your life. forgiveness makes letting go easier.,landpsychology,1.5
were tix purchased or free?,bonchette,0.8
a true relationship is when you can tell each other anything and everything. no secrets and no lies.,relaaationship,1.75
 also. arguing over facebook is just... .puts all people on mute until november 2016.,cantidiamore,-0.8
congrats charlotte on a great event. #lcsm,BrendonStilesMD,1.5
happy hump day. and a fab #woofwoofwednesday to <laugh>,ironmaids,1.0
i hate critical people and have deleted them all. so now my facebook is all happy nice people. which can be so irritating!! i think it's me.,ccart31,-0.6
 ofcorse he is. he's a white cop in america that killed an black teen,_takeachantz,-1.2
 you still planning a trip in tomorrow? i called emerald &amp; they don't have keys yet but we were hoping to grab one in the am,tukatweet,0.8
the stakes were high. lives were on the line. but no matter how hard i tried. won the day. #snakesandladders,soaklord,1.25
got an appointment with the dentist tomorrow. as much as i hate going i want this shit sorted jfc.,quartermaaster,-0.5
for a movie about animates animals. the lion king really speaks to me on an emotional level,AlisonGrasmeyer,0.6
people are more likely to cry at night because the lack of sleep makes emotions hard to control.,landpsychology,-1.5
some people can't hang. #tragic,ZeeAsianBarbie,-0.8
 also this is the entire nekoma team aka the cats. look at my cute children.,thrdplanet,1.75
remember love. you are a light vessel.,Galafani1,1.0
#fact: when you're in love you remember 30% of your dreams.,4h2oCharity4h2o,1.2
#throwbackthursday featuring the limited-edition cinnamon buns 3-in-one gel for our sweet 16 in 2011! #tbt #philobday,lovephilosophy,1.2
yayyy!! so proud of myself!! my professor wants to use the website that i created for an example for her classes next year #yayforgoodgrades,ZeeAsianBarbie,1.4
i am pretty sure everyone is waiting for yoongi to sing,sugasweg,2.0
. so rocks... paying dartford crossing charge on my phone on m25 was super easy (nb: i'm not driver/at wheel),eileentso,1.0
i cannot wait for my life in a months time. everything will be so less stressful,abbiexmcmaster,1.25
 they're pretty good. you should check them out.,YourPainAintLuv,1.6
today's gonna be fun,xntisxcial,1.6
#sagittarius have the lowest bs tolerance.,1_Sagittariuss,0.0
i am loving the fact that as i get older my relationship with my parents is going from good to great.,_kialynn,1.8
 i love your bag!!,rjfr_,2.0
happy it is friday. ready for a productive day at work! #selfie,Emma0839,1.8
 why so serious??,saltandburnitt,0.0
what i discovered to be the #1 game changer in my life &amp; business this year,HillaryRubin,2.4
when was the last time you saw a ku team lose 9 games in a season? #wellbeback,They_call_me_po,0.25
 it was both beautiful and traumatizing xd,TheAnglophiler,0.0
 #nhsdebate maybe the daily mail would get better if they reverted to using hot metal typesetting too...,benwuk,0.4
nearly everyone you meet has something fascinating to share. d... more for scorpio,shanamaina,0.75
he thinks i prank called him like wtf i don't even like you,rivera_thoee,-1.4
cut the sugar out of our child's life. in 1800 the average child consumed 2 pounds of sugar a year. today it's 87 pounds!,_DearParents_,-0.5
i may fall asleep.. this could be awkward being driver today lmaoo,taylorgracex,0.25
when you make it to your charger when your phone is on1% #clutch hahahaha,uknowcamille,0.6666666666666666
today is going to be one long fucking day.,quartermaaster,-1.6
i know i already have a job but i am seriously considering prostitution for another source of income #tooskintforlife,paulreilly112,-1.2
all i can do is to shut my mouth and let slip the pain away.,chocoaddict23,-0.6
wanted by hunter hayes is my new favorite song&lt;3,wild_is_my_life,1.4
 happy birthday girl!,ShreveB,1.75
john o'mara's wife is awesome.,TimiFrost,2.0
 i just see all your convos with long convo with other fans an i get one reply but guess thts not ur fault,AW_reptiles,0.2
 have a lovely sleep ily with all my heart,sassbuteraXO,1.2
i'm sorry but i'm the type of girl you can compliment and i won't believe you. but you say something mean i will remember forever.,X_Not_Perfect_X,0.6666666666666666
 yep. didn't even come for nanas birthday,skyesailing,-0.25
 you you you!!!!!!!!!!! aaaahhhhhh!!!!!!!! hahahahahahahahhahahaahah gerald wtf,CLAIREDRAMIREZX,-0.5
 i have no sufficient strength to tell her <sad>,theakmlshh,-1.5
 i cant seem to stop,afooltocry,-1.0
helping out at this blood drive for community service,_takeachantz,1.0
honestly goin off some people. really bad.,taylorgracex,-1.25
 sullivan! maybe we can all get together somewhere!?,CarverKrista,1.8
oh god this colds is killing me! ugh,selinnakyle,-1.6
 shy reacts to the news no boats full of asylum seekers came last month. soldier on their comrade (yeah i meant the their),supergoodlus,-0.2
i hope you people don't think you hurt my feelings bc u didn't i hates like everyone in that place anyway so fuck you!!!!!!!!,Wright98Isaiah,-1.4
 inites to private sales. eh? sounds suspicious. *signs list and awaits inites* #anythingforanipadmini,tukatweet,0.25
 just. truly feel that tories are setting labour up for another 10-15 years of big wins again.,Fletch_Butcher,1.0
woman sexually assaulted in buntingford while waiting for early-morning bus,MercuryPaddy,-1.75
#jharkhand named strong 14-member archery contingent led by deepika kumari for the 35th national games to be held in kerala from feb1 to 9.,mpparimal,0.4
someone buy me my next tattoo? halloween destroyed my bank accounf,RobbiZombi,0.2
.....lol. you grew up!! plus i didn't look at the picture. just the name.,ChiquaMeii,1.0
hello. to all of you currently stalking my twitter. have a nice day and i hope you find $10 on the floor.,shieldagentskye,1.0
 jordis is the best,ShadowNinja1611,1.75
we can't even be friends! : #wecantdateifyou a devout christian,TopAz_TayLoR,-1.0
 i do exist,sassbuteraXO,0.5
 nice try steve. <tease>,Harrison101HD,0.8
(cont) although i too got like.a bit screwed up but hey..,stina_wilson,-0.25
 hi i miss you,ZeeAsianBarbie,0.5
perhaps late to this. but #netanyahu is talking about and iran-lausanne-yemen axis. akin to a new axis of evil. it's 2003 all over again,LukeReuters,-0.4
lol that girl blocked me,YounowExpose,-0.2
i seriously can't stop crying. it just hit me today that i've reached the single digits until the day i leave.,sleepycoyotee,-1.2
 yup. back to square one. dame ko tuloy kailangan ayusin pa haha,janwesley,-1.0
 my favorite jazz musicians of all time are: duke ellington. miles davis. najee. fred wesley &amp; boney james.,WillJaxx,1.25
went to belle chasse with my baby today. had fun with his stupid ass,SaveThe_Tits,-0.4
the doors we open and close each day decide the lives we live. the path you choose to follow determines where you go &amp; who travels with you.,bob_hoffmann,1.2
 <happy> man i made another mistake i won't stick up for a friend anymore,rockyyyyy15,-1.75
sometimes you have to be your own hero.,iEmyLife,2.0
ya feel me tho lol tha turn up is inevitable,CharMeLoDi,1.4
rollins vs ambrose is happening tonight. with j &amp; j security banned from ringside. seth is furious with kane right now. #raw,SupportingBryan,-0.2
my godnessssss.... what a goaaalll saurezzzzzzzzzzzz..... fuck je did a rooney with his weaker foot....,Ajinkyaworld,0.5
she hissed back at her friend. as-,ValiantIryoNin,-0.25
 don't forget about teen wolf fans too pls. arrow is also cool. but teen wolf. you make an awesome lizard dude.,yourghostlyfox,0.5
faith... sees the invisible. believes the unbelievable. receives the impossible. hello friend.. <happy-tears> ,TriaLucila2011,1.8
ugly ducking celebs: i can't believe taylor swift used to look like this!,DemiLvatoFacts,-1.0
 oh that's not good at all!my mother thought the same because that what was used to happen but not anymore!,All1DGirlz,-0.4
