Tweet,Username,AverageAnnotation
not giving reese a pass tho. his drafting is y we have to try to lure free agents here. but at the end of the day. guys have to want to come,Sum1UshouldNo,1.0
soon that earth began to shake as if it was being torn apart oh no! it's going to go boom!,aromaticBayonet,-0.6666666666666666
 didn't know u had a brother. my condolencez  : breaking: saudi state tv reports: king abdullah has died at 90. ap says,Thav916,-0.5
 decades later. scarb's eateries are 'discovered'. happy for the coverage anyway (yay for scarb's businesses!) no matter how late.,HelenStratigos1,2.25
 tell whoever is pissing you off to step on a lego,wild_is_my_life,-1.0
uh especially when they're destroying you maybe,_karasunos,-1.75
 although being unable to run everything. all the time. i'm trying to be a little more discerning now. good luck with #tdg.,theMonkeySmokes,0.2
 you're in co?! enjoy boulder! let me know if you find yourself any further south.,bubafettt,1.0
are you ready to #holdon today?,lucafex,1.0
 had to resign myself to that,Sweyram,0.0
i fucks with kendrick though. his freestyles are crazy.,Reemaveli,0.4
 love u so much,brenna_annalise,1.8
me - don't worry it is,Sizzurp_713,1.25
okay so 4 girl friends are all i need.,YourPainAintLuv,1.0
why don't you shut the fuck up?,TOUCHDOWNIALL,-1.75
#mondaymotivation: dream. work and enjoy life...,4charityvision,2.2
oh man. i can't handle talking about aiden. #revenge,Island_Lvng_MW,-0.4
i fucking hate that trans care in the us is so shit that some people are practically forced into diy.,EmmaQuack,-1.75
 &gt; slowly letting go as she pulls away. placing a kiss on his cheek &lt;,aromaticBayonet,0.6
somebody please show me how to walk while the bus is moving!,_JessicaHo_,0.4
i nodded. mutely supporting his &gt;,NaturesParamour,1.2
 i mean kinda like what you have to use unnatural shit to look good if she didn't do any of them she wouldn't look good,ABisshhh,-0.6
 thanks man. love ya too. we gotta do another camping trip or something soon.,rscotty67,0.8
chris brown is one of the most talented people to ever live.,Rike12Modriguez,2.0
 what if amber was cranky and crazy? if she was i think i would've delt with it. what about you?,rapcatchyhooks,0.4
i'm about to start crying jamie's train literally leaves in an hour and a half for chicago,wtvcaitlyn,-0.4
 that's cos everyone else was picking their jaws up off the floor,TomBlott,-0.75
this movie is hurting my heart,saltandburnitt,-1.2
im not feeling good at all,_JessicaHo_,-1.6
she still loves me,anjellaye,1.5
i'm hungry as shit and there's no food. so i guess i'll just take some shots. #logic,Squantoe_,-0.8
i just freaked out because my blankets were moving and i realized it was kila,ZeeAsianBarbie,-0.5
her: just cut my damn hair. i'm hungry af.,Rike12Modriguez,0.0
damn. this is harder than i thought...,Tadpole_03,-0.8
i have insomnia like a mofo #sleepdeprived,PhillipJCarter,-1.6
 kent wants some banana bread... with nutella if possible. lol.,ccart31,0.25
i just talked with the school's therapist for almost 80 minutes. i feel alive,MrsDaiki,1.8
1. i'm not a slut 2. i'm not one of nate's night stand 3. why on earth would i fuck nate,twurkdallas_,-1.6
don't dwell on the past; learn from it. #inspiration #quotes #past #future #lifelessons,UniverseLetters,1.75
coalition adviser urges increased investment in early years funding,ElzbietaVine,1.25
a failure is n...,Adlewis91,-0.3333333333333333
congrats to &amp; lucy for going low today!!#qualified #liscavo #usga #womensfourball #uswfourball ,catherinescavo,1.25
i just keep on making the same mistakes,pllllayer,-1.6
#pisceans can sink into deep depression by their susceptibility but soon back.,ViralHoroscope,0.2
#capricorn are always pursuing something and trying to use it to their advantage when they need to.,Zodiac_ebooks,0.0
 hahahhahahahahahahahhahaha i hate youu hahaahhahahaha joker hahahahahha struggle*,yOgI_jYoTsNa,-1.4
how have i only just discovered a beautiful mesmerising #folk acoustic trio ... perfect for a sunday afternoon #happymusic,Happy_Boho,1.75
why be the boyfriend she wants when you can be the boyfriend she needs?,YouKnoHim_Travi,0.5
my last . i hate twitter. bye forever.,taash_xo,-1.2
i was so happy just 3 days ago???,sspankayy,0.0
having an amazing nap but dreaming a spider was walking over me; resulting in me throwing my water out the window and jumping out of bed,_morgan___,-0.4
#votetrismtv she's lost everything but she keeps going,thehybridthings,1.25
kahit gaano pa kalupet mag rap si smugglaz at abra. . . . . . . . . . . . . . wala paring tatalo pag nag rap na si mudra. <happy>,eksotinkerbell,0.0
like why am i not in florida right now?,Tinijensen,0.0
no one can tell u that u deserve better. its ur choice to realize it or not,CoupleQuuotes,1.4
 you always see the worst out of what i tend to like.,PeachHayden,-0.6
 allow me to present percolate by catchy hooks available on itunes. music that'll make happy hour happier. twerk!,rapcatchyhooks,2.0
at no stage was my query re spiked food/drink taken seriously by medics. in 2004.no exploration made of physical symptoms on 6/3/04 or after,HelenGavaghan,0.0
 - from him. however..she fought it. ..o..okay. okay. but..don't come any closer. please.. it was a plea. less a request.,Bonnibel_Peebs,0.25
 i like leitch but this piece is mega-stoopid,adrianraiford,-0.3333333333333333
here are some tips but i would love you to share what has...,dawnranieri,1.3333333333333333
love this! current leader draws inspiration from his sister ellie.,catherinescavo,1.6
i miss sam. ;~;,Clem_Walker,-0.8
i'm all alone and no one cares.,X_Not_Perfect_X,-2.25
and then we would be home at like 12:30,MrsDaiki,0.2
i haz choophobia/trainobia,SkippyCinematic,0.0
while ontario has ex-dep minister education (liberal) charged w child porn (truly horrifying). media is hyped on duffy family visits+lunches,HelenStratigos1,-1.6
: i want friends i volunteer,pixjeperry,1.2
the discussions of perverse whichdoctor's and defence mechanisms.,Adlewis91,0.0
is sleeping with the tv on a sign of stress?,tkl277iztha1,-0.8
whatever keeps on troubling you.bothering you and making you worry.bring it to jesus and let him fix it;,WINIMINISTRIES,1.6
 ::sigh:: not a double standard. it's about *power* and sexualization. the can explain,MaraGreengrass,-1.0
ion fw nobody like i use too .,_ShystLife_,-0.25
why do people act like its hella weird and unnatural for me to have two jobs lmao,bellzuh_,0.0
good morning ! count down to back-to-school in orange co. anxious for our new group of vpk. teachers are pre-planning,HOLAcademy,1.2
dockworkers outside the shipping ministry building protesting against the olp privatisation. #athenslive,athenslivegr,-0.4
i forgot what it feels like to call you and you actually care about what i'm saying.,younghov_,0.0
 haha no probs lilly,Adlewis91,0.4
 busted xbox one drive. not the best of my xmas surprises.,soaklord,-1.2
 i'm howling omfg. the common jay z attracts his mate with his very large lips.,chelsreynolds1,0.75
#celebrate!! 7 layer #fiesta nachos!!,JoseOleCentral,0.4
 it's like hearing music for the first time. i've been missing so much complexity. and noise canceling in earbuds whaaaaaat?!,GraceOnTheFarm,1.0
my dads getting so mad at me saying if i don't have the tickets he's not driving me to doncaster,trashlirry,-1.2
conversations could feel challenging over the next few days. be clear with yourself about your position then keep it simple. #newperspective,my1heart,1.75
that's like for the first time ever,silencieux95,1.4
q2: as a student teacher. how do you/will you involve students in the formative assessment process? #edteach,MeaganFL,0.2
i honestly could give zero fucks about you and him,Tori_Mace,-1.4
in general idk why. but i eat my meals hella slow!,uknowcamille,0.0
 and i on our way to #thepasendaplayhouse to watch #sleepingbeauty with #oliviaholt. #excited,rykamilo,1.5
 ouais c'est sur,Alicia_Dkg,0.0
am an idiot because i can't who is riffing now at #zeitgeist15,eileentso,-1.2
one of my favorite what sweet hell is this discussions was european astros complaining abt us federal demographic data collection,IBJIYONGI,0.4
we will be here and jonathan will win this.,Sweyram,1.6
#sagittarius - powered by fun!,SagittariusTwts,1.2
 i want to say he has 3 sisters but maybe i am wrong and it's 4.,threelilbirdsss,-0.2
washing my darling baby bottles. washing clothes. cooking and preparing for work! #singlemom,Emma0839,1.2
do me a favour. and send @.ghiblicats some love. just tell her it's gonna be okay. she really needs it right now,GhostlyFoxGirl,1.25
let's go check ur credit score!!!!,bellzuh_,0.5
if you are still undecided. try to see whose policies you really support without the distraction of lies and propaganda.,naomi_1,0.2
 i broke a nail on my dominant hand i am obviously more distressed,Tape_Dispenser_,-1.25
when i woke up. it looked like we had passed orlando. so i panicked (as usual) and checked my navigation just to see where we were lmao,schontherattler,0.5
been up just thinking about everything that's happened all the decisions i made good/bad,Vonnoo_Mariee,0.4
yak baba ng jobstreet english language assessment score ko! pero at least 10/10 ako sa conversational at comprehension part haha!,janwesley,1.0
 why stop when you can just keep going? i'd rather be bad then good honestly she looked at him what brings you to~,Full_Of_Greed,1.75
 oh wow. looks amazinh,aliettedb,1.2
doesn't feel like a saturday today. strictly isn't on tv for a start.,naomi_1,-0.75
 that actually looks pretty good tbh. might have to pick it up,Calibre266,1.2
av nae fuckin energy or heat in ma body what so ever. feel like pure shite,zairaafzalxx,-1.25
 when i watch yeldon run. he seems like a perfect fit for the colts offense,raptureveteran,1.3333333333333333
wars are to be fought by groups of men. forgiveness is given to and by the individual.,JessiKersi,0.5
 not that she actually read it. but i still wanted to try! why is it ok for comedians to comment but not other celebrities?,DeanneCP,0.0
 wahh akak tak sekolah dah okayy *libas rambut* haha bella tido dah .,RainaNadia,0.0
today i'm speaking at . really excited. mostly b/c last time i did this. i successfully recruited the illustrious ,bennydotevents,1.5
and now i have a headache too yeah this is fine real fine,silverfuckr,0.2
#bestfriends #babes #mygals #tulli #girls #favs #fleeto #gay #gayboy #paulsbitches,paulreilly112,0.4
good god its hot out side 2day!,kisione,1.6
 i did not. i remembered i'm too poor to order bbq and too lazy to go get it. haha.,cantidiamore,-0.6
 becose you are. i choose you to save me. hero,PrincessXMalik,1.75
hate the mythos. hate the lack of mulder. but you cannot hate the standalone episodes. so good! #txf #season9,AllThingsMSR,0.5
the ukip propaganda claiming that educating children in lgbt issues as 'sexual grooming' to 'recruit fresh blood' makes me so mad.,naomi_1,-1.2
the sakura petal dancing on my palm. beauteous. frail. ephemeral. reminds me of you.,theakmlshh,1.0
i have learned that sometimes sorry is not enough. sometimes you actually have to change.,bob_hoffmann,0.8
what's happened to it? if it's been nuked or something i might as well stay here ,The_Bounder,-0.4
holy hell! u.s cellular field is eeemmmpppttyyyy!,brinilove,-0.2
i am so excited u know in case u guys already didn't know how excited i am,APPARITlONS,1.5
 tell them the english want a say. no oil without their share of debt,3cambrai,0.0
 is #hero. read about this fan.,sayin_kAt,1.25
like at least make them realise that you're there no matter what??,azimahtan,0.6
feeling mad anxious...! urrgggh!,yOgI_jYoTsNa,-1.4
felling happy and optimistic,bachethan22,2.3
last time i went out for a meal with my family was like last year. so this is a big deal,unkkn0wn_,0.2
 sorry to hear about that. glad that she wasn't in pain. my condolences to your family!,WhoIsDo,-0.5
#sagittarius has a zero tolerance for bullshit.,sagittariusee,-0.7777777777777778
. under the impression it is but that's no guarantee of anything -,knoxkp,-0.4
 and the fin. min.'s protesting cleaning ladies meet in maximos mansion #athenslive,athenslivegr,1.0
#sagittarius radiate a sexy confidence that attracts everyone.,1_Sagittariuss,1.4
i don't know who had the more stressful morning: me driving a 30ft truck through iowa or the #arsenal fans that actually watched the match!,Dwade,-0.6
however. i am smiling as it could always be worse. could be rovers. pne. blackpool. leeds(!). superior... #twitterclarets,ClaretRaz,0.0
 sorry - it's a long way to travel from london <sad> but a very warm and welcome offer. eid mubarak! <laugh>,benwuk,0.6
 c'est pas faux. c'est vrais que tu es d'une grande gueule,Alicia_Dkg,0.0
our bodies are truly marvellous and continue to regenerate everyday ... #breathe #slowdown #eathappy #findbalance x,Happy_Boho,2.5
sounds like walton could even play some de. which they might be thinner there. solid.,Thav916,0.0
#sagittarius likes a little challenge in a relationship so dont be a pushover! stand up and push back. that turns them on.,sagittariusee,1.4
to all the ladies and gentlemen that are members of #hairlista and are interested in joining me on the #cast,Vannie3000,1.8
 u were defending urself but were u defending your best mate or your fans that loved you for 5 years?,adorb_zayn,-0.25
 well.you don't look very familiar to me... greed was slightly confused and yet curious as to how he knew her.,Full_Of_Greed,0.2
walked about 3 mile just for my haircut in the pissing down rain,ChrisRafc1995,0.3333333333333333
 its cracking isnt it ... our designer is very eggcellent <happy> happy weekend lovely lady xxx,Happy_Boho,2.0
as the five naruto's ran at her. she would fake a swing of her-,ValiantIryoNin,-1.0
if you talk shit about your ex girlfriend and you're the one that screwed her over you need to reevaluate yourself because that's pathetic,ShainaDawnn,-1.8
it might look sketchy asf at night but i still love this,caitlinnk_,1.25
 no but i have it on my amazon wish list for almost two years loooool. do you have the book?,A90s_,0.4
at this point. even dandelions are exciting.,Awes_ma,0.8
currently in the hospital &amp; i have class at 9 &amp; work at 4. tomorrow should be great,_cha0sxo,0.4
it can't snow wednesday though cause we won't get off school and my brother needs to fly in.,PPR_8,0.6
how can one not love better than ezra,alevilevi,0.6
 just click on follow. it's easy,xlarry_rainbowx,1.25
pi claim by prisoner fails. livingstone's book very useful on evidential problems faced by prisoners.,MaryRogan,0.2
 btw loved the slide art.,soaklord,1.25
i hate pizza. but i'll eat it just this once xd,ryansgaybies,0.2
 no there most certainly is not,TheFlamicon,0.2
 how about hey. jerk! play these games. would ya??,rdelvillano,-0.25
 actually we do. but i don't want to get too excited. should we be worried about tomorrow's weather?,selinnakyle,-0.25
 don't worry i don't think i have anything going on this sunday !,jvanryn2424,0.5
 that's really cool! go for it!,Tape_Dispenser_,2.4
: what's your favorite color? purple,DeanneCP,0.75
is always right ugh,penglouin,0.0
but i don't wnat to go to the trouble of hooking up my amp. starting up my daw. etc,EmmaQuack,-0.25
 good on you for challenging it though,GracaMutseyami,1.2
be the best place to be,3cambrai,1.2
i don't even fuck with you honestly ... like haven't you noticed already bitch,trippedvibes_,-1.75
 nfl network is dominating espn today. just flipped to espn during a commercial &amp; experienced an awful &amp; awkward discussion,Thav916,-1.0
we have to work together ok? i'll trust y'all on the fact that you're streaming his mvs atm <happy>,heavenlygyu,1.0
 &amp; camille were very engaged in our team activity today. caption this. anyone?,Arlene_HR,1.0
 good i love being pissed but also tbh it's hard to find sad music that isn't too sad and like slow,realdanascully,-0.8
i kind of feel like hes purposely hiding the thigh tattoo i just wanna talk,realistiches,-0.4
 thanks for reminding me it was on! recording now.,naomi_1,1.0
when people have doubt in me whether it's music career or occupational. it only motivates me to prove them wrong.,rockzist,1.0
 yea just need to getting my hopes up,shanamaina,1.4
words cannot do my excitement justice. if fights like this come around once every 20 years i'll be 42 by the next one #mannyvsmayweather,MercuryPaddy,1.0
*when it's gone. it's gone! save up to 70% off products! visit my website tab and click on brochure 19 to see what items are available!,dawnranieri,0.3333333333333333
no school equals drivers ed for hours. i guess it'll pay off. #freedomawaits,taylor_annem,-0.4
every time you smile at someone. it is an action of love. a gift to that person. a beautiful thing. -mother teresa,JessicaLisyus_,2.2
just go out and love life!,EveyFitzpatrick,2.2
well deserved mvp award. congrats alyssa valdez!,janwesley,2.0
if you still want me to stay. i will. i will because its what i want too. i loved to hear those beautiful words...,chocoaddict23,2.2
pati mga sidekick may clash hahahahaha,maaaaamro,0.0
so whatever you're going to do.... you better do it well !,Meet_Nallah,1.2
okay 11pm na study na byebye,maaaaamro,0.6
 miss you too!,brittney_lerma,0.5
ima stay to myself just single with no hoes. starting not to care,Sug_arPlum_,-0.2
 i think would agree <tease>,ChadWst,0.8
love you vs i love you,_fxckhan,1.6
so ready for bey's look at the met gala,Sydni_Briana,0.6
check out these beautiful paintings available from valentin katrandzhiev!,sandystrohs,1.2
good things about not going to south america: the crowd would probably be so wild i would die. and it's too hot in there. <happy>,FooledBySecrecy,0.8
 ring bearer pony? lol,bridezilla_life,-0.25
maybe later i'll find a worthy man. or i won't. i'm ready to be a man (protector) for myself: i work. i earn money. i encourage myself...,TatyanaB5,0.75
some professors be acting like we only have their class,_takeachantz,0.0
 i just watched babadook last week &amp; boy did i ever love that movie..in the most uncomfortable way,afooltocry,-0.2
 okkkk i don't hate your stinking guts,reynsss_,-0.3333333333333333
what #barca need is a strong defender who doesn't care about his body getting hit by any force. that will help the mid to play its role,Ajinkyaworld,-0.4
 i'm sorry... she whispered. softy. i'm sorry i wasn't the one to find you..and i'm very sorry i didn't just stop you..-,Bonnibel_Peebs,0.0
christ is risen. he is risen indeed! happy easter!!! celebrate the risen lord.,TimiFrost,1.0
 love it. love her. miss u. #unicornlove,travelgaljd,1.8
 she nodded and sat back down by the riverside. are heading off the investigate the murders?,Demonic_Abigail,-0.75
#libra: the best of you. is your sociability to adapt to anything. the worse your indecision sometimes improvise unsure.,ViralHoroscope,0.75
 good to have you back. this place could do with your humour.,BlueCR4,0.6
think like a hippie,rockyyyyy15,0.5
 i haven't finished my project yet. i'm leaving before i have to turn it in though haha,CGommo,1.2
witnessed the most dirty ice hockey fight ever. player number 4 for hull university needs to be kept on a leash #welldoneuob,GracaMutseyami,-1.25
alone in my room watching,zouisfitch,0.4
i'm so done. i hate my life.,xxviiimmxx,-2.0
when you believe in people. you know u take a huge chance of getting let down. how come it surprises the hell out of us when it happens?,sjcutie77,-0.6
 hey! sounds like me!,caitlynsalalala,0.6
 i hope no one does a deal. i've heard worrying stories cameron giving ffa in exchange for evel. we'll find out soon enough,Effiedeans,-0.2
you shouldn't keep tabs on loyalty.,Reemaveli,-0.5
i really should mute oomf for my peace of mind....,tkl277iztha1,-0.6
 i missed you there bro. unless you were dressed as a supermodel. to which i would say. nice dress.,bennydotevents,1.6
 agreed; we're trending the right direction and making progress imho,eileentso,1.6
kasey hill is this teams version of jeff driskel. more he plays the angrier i get. kid is utter garbage,raptureveteran,-1.5
it takes black magic to manage any 12 year old girl. let alone a witch #bittens2,birdkittyme,-1.6
so pumped to have gotten accepted into criminal justice,Wright98Isaiah,-0.25
 i really hope you're ok and that you seek help whether or not you suffer from something or if your father did abuse you,shiminlim,0.25
healthy. easy. your kids will love these!!!...,IsaFueled,1.75
i hate how everyone is just jealous everyone is jealous with the u.s fans and now u.s and uk fans getting jealous with japanese fans,CLAIREDRAMIREZX,-1.0
 prestigious title in wwe. i think brock winning hurts him but if reigns wins he'll cash in successfully.,SupportingBryan,1.0
who likes my #eurovision ... i guess i'm going to wear these to death over the next two weeks #vienna2015,Refshaleoen,0.2
it's ok. i can remake them if i need to. they won't take more than a few hours. i know what i'm doing. it's ok.,quartermaaster,1.0
the best friend is excited. the best friend misses me.,____glencoco,1.4
i want to listen to muscle museum but not sure what would happen,FooledBySecrecy,0.2
thank god it didn't smash,trashlirry,1.5
fml i forgot to take two online test. there goes my grades. #stressingout,puakea_,-0.6
admit it. no one wants a definitive answer because that would kill the fun,ShakeyGr4ves,-0.75
#mondaymotivation: never let anger and pain change the person you are...,4charityvision,2.1
good to tie down to a new deal. an absolute warrior of a man and improving all the time <laugh> #twitterclarets,ClaretRaz,2.3333333333333335
 hope you got my book w #growingupsocial thx for sharing. hugs to you,ArlenePellicane,1.6
just let #annielennox play the rest of the night. #grammyawards2015,JAsports70,0.0
 you'm sure are,therobotjane,0.6
 i played trumpet for 9 years. i might be able to help?,TheAnglophiler,1.2
i really need to get a fake i.d.,ZeeAsianBarbie,-1.0
 lol another tu at rahimas,ZeeAsianBarbie,0.3333333333333333
your not leaving but for the time being were on a break . what the fuck is that bullshit . bye might as well be honest,trippedvibes_,-0.6
 ah...semalam orientation kan? thank you! congrats to you too!!,VanillAnaa,1.8
 it was a really good ep. watched it today during a break in revision.,naomi_1,1.4
 thank you very much!,Meet_Nallah,1.2
today when we dropped chloe off there was a spider on the seat and she started freaking out and it was so funny def best part of my day,zoelyoung5,0.0
get cute for school then wonder why,pllllayer,0.8
 really hope so say the english,3cambrai,1.0
 soon bby sooon like maybe even tomorrow i think haha!,yourghostlyfox,1.5
ohmss is love.,therobotjane,1.75
thanks ! and good luck #ignite #omaconf2013,mambolica,1.5
 to be honest none of the performances bothered me much. whether it was something about the recording i don't know. bit odd.,asmallmind,-0.5
 there's no reason to be mean. i was helping you out.,Rike12Modriguez,-0.75
i feel like a big hungover flamingo #ghettofabgurl,paulreilly112,-0.8
 sorry la alinn..,theakmlshh,-0.2
check out my tip on about how to live a more beautiful life in 2015,HillaryRubin,2.25
your favourite song out right now?,TEAMKRUZE,0.8
: men tend to overestimate women's interest in them. and women tend to underestimate men's interest. i believe this is true.,sjcutie77,-0.25
casual reminder that none of the public bomb shelters in jerusalem are in arab or palestinian neighborhoods. #israelunderfire,kateljacobson,-1.0
 every time you tweet. i rise from the dead and cry at the same time because you didn't notice me,tralalukey,-1.2
 ha sure brian! only because you said i'm awesome and a beautiful singer though <tease>,Shes_Hopeless,1.25
1th 5:22 throw out anything tainted with evil.,RhemaTweets_,-0.2
here's a reminder: if you want to change your body. make sure you're doing it for you- your weight. hair. etc isn't anyone else's business,RecoveringWhite,0.75
i seriously cannot go to sleep to save my life.......,CatieKing21,-0.2
 listen to your gut!,wimpysoftheart,1.0
thank you for making me a #nascar fan #94brickyard ,NASCAR_WXMAN,1.4
 lets get a nicki black friday lil kim inspired tattoo on a friday the 13th,rjchrd,1.2
i love you huang zitao. no matter what #sbspopasiaexo,eksotinkerbell,2.0
golly g i'm a loner,zoelyoung5,0.2
the veggie tails theme song is so damn catchy,CGommo,1.4
psychologists say. the people with the best advice have experienced a lot of issues in their own life.,landpsychology,0.6
 thanks! about to play now. <happy>,meliss_hughes,1.25
 lol none of us won... awk,cieramackel,-0.6
i hope i get ichigo today. i need my prince to come home!!,rouukun,1.25
you wanna make a tweet about her again and i promise i'll kick your fucking ass in a matter of seconds.,Tori_Mace,-1.4
nahh im a good person. just dont dont take opinions the butt. lol,xSteph_aniee,1.4
 this made me laugh audibly. #tooproudtosaylol #havefun!!,aspiringkennedy,2.0
how to create the perfect tweet infographic to share w/new users,Arlene_HR,1.25
 hmmm interesting. i'll have to check it out,Sum1UshouldNo,1.2
#quote #quotes #soulmate #life #love corkyclue,lucafex,0.6
 i have trouble hating too much on vice taxes. even the ones on my vices. probably the most fair form of taxation.,Dwade,0.8
it feels weird when we haven't really spoke all day,_takeachantz,-0.2
ppl read violent words on the internet + panic that the ppl behind them aren't good ppl. but they'll celebrate ve day + men with guns.,mburnhope,-0.4
 ate pao! kalma! they're not worth the tears of a perfectly sensible fan like you! <happy>,maaaaamro,-0.4
 wow. he sure is angry...,Dwade,-1.25
hahaha!!!!! sooooooo true!!!!!!,IsaFueled,1.4
 i take it off even for hand sanitizer lol. i'm just a little anal about it. whatever. lol.,bridezilla_life,0.5
this time of the year makes me love being from this area. i admit i'm hard on stl but i love so many friends coming together to celebrate,RobbiZombi,1.2
